<?xml version="1.0" encoding="UTF-8"?>
<!DOCTYPE catalogo SYSTEM "catalogo.dtd">
<catalogo>
    <libro>
    <titulo>El Quijote</titulo>
    <autor>Miguel de Cervantes</autor>
    <anio>1605</anio>
    <categorias>
        <categoria>Novela</categoria>
        <categoria>Cl√°sico</categoria>
    </categorias>
    </libro>
</catalogo>
